{
  "profile_schema_version": 1,
  "id": "gsd_patient_journey_mapping",
  "version": "2.0.0",
  "name": "GSD patient-journey de-para mapping",
  "description": "Measures whether the supplied evidence supports at least one concrete functional de-para from an existing solution to an education, longitudinal-information, or care-continuity need in the glycogen storage disease patient journey. Auxiliary criteria identify the non-exclusive destination categories and contextualize how directly the solution already addresses GSD or adjacent conditions.",
  "instruction": "Evaluate functional de-para potential, not literal disease adherence. Judge only capabilities explicitly demonstrated by the supplied evidence. Count a capability when its documented user, workflow, and information function materially match a defined need in the glycogen storage disease patient journey, even if the solution was built for another disease or population. Do not require or reward GSD terminology by itself. Do not infer missing product functions, operational availability, clinical validity, regulatory suitability, interoperability, or configurability from branding, generic claims, or plausibility.",
  "criteria": [
    {
      "id": "functional_de_para_fit",
      "role": "core",
      "weight": 1,
      "instructions": "Does the evidence demonstrate at least one operational solution capability with a concrete functional de-para to an education, longitudinal-information, or care-continuity need in the GSD patient journey?"
    },
    {
      "id": "patient_caregiver_education",
      "role": "auxiliary",
      "threshold": 0.7,
      "instructions": "Does the evidenced solution capability map to delivering structured health education to patients or caregivers?"
    },
    {
      "id": "healthcare_professional_education",
      "role": "auxiliary",
      "threshold": 0.7,
      "instructions": "Does the evidenced solution capability map to delivering clinical education or training to healthcare professionals?"
    },
    {
      "id": "clinical_history_record",
      "role": "auxiliary",
      "threshold": 0.7,
      "instructions": "Does the evidenced solution capability map to maintaining and retrieving a patient-level clinical history across time?"
    },
    {
      "id": "care_coordination_navigation",
      "role": "auxiliary",
      "threshold": 0.7,
      "instructions": "Does the evidenced solution capability map to coordinating handoffs, referrals, tasks, or next steps across a patient's care journey?"
    },
    {
      "id": "daily_self_management",
      "role": "auxiliary",
      "threshold": 0.7,
      "instructions": "Does the evidenced solution capability map to helping a patient or caregiver carry out and document an ongoing care routine?"
    },
    {
      "id": "monitoring_follow_up",
      "role": "auxiliary",
      "threshold": 0.7,
      "instructions": "Does the evidenced solution capability map to repeatedly collecting patient-level status or outcome information for follow-up?"
    },
    {
      "id": "prescription_care_plan_management",
      "role": "auxiliary",
      "threshold": 0.7,
      "instructions": "Does the evidenced solution capability map to creating, delivering, managing, or tracking a patient-specific prescription or care plan?"
    },
    {
      "id": "emergency_transition_support",
      "role": "auxiliary",
      "threshold": 0.7,
      "instructions": "Does the evidenced solution capability map to making essential patient information or care instructions available during an emergency or care transition?"
    },
    {
      "id": "operational_solution_evidence",
      "role": "auxiliary",
      "threshold": 0.7,
      "instructions": "Does the evidence show that the mapped capability is currently available in an operational product or service rather than only proposed, planned, or described generically?"
    },
    {
      "id": "direct_gsd_relevance",
      "role": "auxiliary",
      "threshold": 0.7,
      "instructions": "Does the evidence explicitly state that the solution supports glycogen storage disease or people affected by it?"
    },
    {
      "id": "adjacent_rare_metabolic_context",
      "role": "auxiliary",
      "threshold": 0.7,
      "instructions": "Does the evidence explicitly place the solution in a rare-disease or inherited-metabolic-disease care context other than glycogen storage disease?"
    },
    {
      "id": "explicit_cross_condition_configurability",
      "role": "auxiliary",
      "threshold": 0.7,
      "instructions": "Does the evidence explicitly show that the solution can be configured for different diseases or care pathways?"
    }
  ],
  "evidence_aggregation": {
    "method": "top_weighted",
    "top_weights": [
      0.6,
      0.25,
      0.15
    ]
  },
  "score_aggregation": {
    "method": "weighted_mean"
  }
}
